{
  "bundleFormat": "agentkit.bundle/v2",
  "agentId": "agent-fixture-01",
  "sourceRevision": 4,
  "resolvedDigest": "sha256:1111111111111111111111111111111111111111111111111111111111111111",
  "runtimeType": "harness",
  "sourceDigest": "sha256:2222222222222222222222222222222222222222222222222222222222222222",
  "runtimeContract": "agentkit.runtime/v1",
  "pluginLockDigest": "sha256:3333333333333333333333333333333333333333333333333333333333333333",
  "compositionMode": "composed",
  "compositionProfileDigest": "sha256:4444444444444444444444444444444444444444444444444444444444444444",
  "hostedKernelRequirementDigest": "sha256:5555555555555555555555555555555555555555555555555555555555555555",
  "files": [
    {
      "path": "composition-profile.json",
      "sha256": "sha256:6666666666666666666666666666666666666666666666666666666666666666",
      "size": 512
    },
    {
      "path": "plugin-lock.json",
      "sha256": "sha256:7777777777777777777777777777777777777777777777777777777777777777",
      "size": 384
    },
    {
      "path": "resolved-agent-spec.json",
      "sha256": "sha256:8888888888888888888888888888888888888888888888888888888888888888",
      "size": 2048
    }
  ],
  "createdAt": "2026-08-27T00:00:00Z",
  "bundleDigest": "sha256:c804568e433c4c83a9e51e25970fd05759b74e95d687d979a7afc9ab8c943266"
}
